No.     Time           Source                Destination           Protocol Length Info
     15 4.699058       192.168.116.176       128.119.245.12        HTTP     575    GET /wireshark-labs/HTTP-wireshark-file4.html HTTP/1.1 

Frame 15: 575 bytes on wire (4600 bits), 575 bytes captured (4600 bits) on interface 0
Ethernet II, Src: HonHaiPr_23:88:cd (9c:ad:97:23:88:cd), Dst: AsustekC_67:19:61 (00:18:f3:67:19:61)
Internet Protocol Version 4, Src: 192.168.116.176, Dst: 128.119.245.12
Transmission Control Protocol, Src Port: 23392, Dst Port: 80, Seq: 1, Ack: 1, Len: 509
Hypertext Transfer Protocol

No.     Time           Source                Destination           Protocol Length Info
     17 4.833277       128.119.245.12        192.168.116.176       HTTP     1139   HTTP/1.1 200 OK  (text/html)

Frame 17: 1139 bytes on wire (9112 bits), 1139 bytes captured (9112 bits) on interface 0
Ethernet II, Src: AsustekC_67:19:61 (00:18:f3:67:19:61), Dst: HonHaiPr_23:88:cd (9c:ad:97:23:88:cd)
Internet Protocol Version 4, Src: 128.119.245.12, Dst: 192.168.116.176
Transmission Control Protocol, Src Port: 80, Dst Port: 23392, Seq: 1, Ack: 510, Len: 1073
Hypertext Transfer Protocol
Line-based text data: text/html (17 lines)

No.     Time           Source                Destination           Protocol Length Info
     18 4.937482       192.168.116.176       128.119.245.12        HTTP     513    GET /pearson.png HTTP/1.1 

Frame 18: 513 bytes on wire (4104 bits), 513 bytes captured (4104 bits) on interface 0
Ethernet II, Src: HonHaiPr_23:88:cd (9c:ad:97:23:88:cd), Dst: AsustekC_67:19:61 (00:18:f3:67:19:61)
Internet Protocol Version 4, Src: 192.168.116.176, Dst: 128.119.245.12
Transmission Control Protocol, Src Port: 23392, Dst Port: 80, Seq: 510, Ack: 1074, Len: 447
Hypertext Transfer Protocol

No.     Time           Source                Destination           Protocol Length Info
     24 5.070507       128.119.245.12        192.168.116.176       HTTP     781    HTTP/1.1 200 OK  (PNG)

Frame 24: 781 bytes on wire (6248 bits), 781 bytes captured (6248 bits) on interface 0
Ethernet II, Src: AsustekC_67:19:61 (00:18:f3:67:19:61), Dst: HonHaiPr_23:88:cd (9c:ad:97:23:88:cd)
Internet Protocol Version 4, Src: 128.119.245.12, Dst: 192.168.116.176
Transmission Control Protocol, Src Port: 80, Dst Port: 23392, Seq: 3970, Ack: 957, Len: 715
[3 Reassembled TCP Segments (3611 bytes): #21(1448), #22(1448), #24(715)]
Hypertext Transfer Protocol
Portable Network Graphics

No.     Time           Source                Destination           Protocol Length Info
     27 5.103995       192.168.116.176       128.119.245.12        HTTP     527    GET /~kurose/cover_5th_ed.jpg HTTP/1.1 

Frame 27: 527 bytes on wire (4216 bits), 527 bytes captured (4216 bits) on interface 0
Ethernet II, Src: HonHaiPr_23:88:cd (9c:ad:97:23:88:cd), Dst: AsustekC_67:19:61 (00:18:f3:67:19:61)
Internet Protocol Version 4, Src: 192.168.116.176, Dst: 128.119.245.12
Transmission Control Protocol, Src Port: 23394, Dst Port: 80, Seq: 1, Ack: 1, Len: 461
Hypertext Transfer Protocol

No.     Time           Source                Destination           Protocol Length Info
    134 5.672657       128.119.245.12        192.168.116.176       HTTP     1472   HTTP/1.1 200 OK  (JPEG JFIF image)

Frame 134: 1472 bytes on wire (11776 bits), 1472 bytes captured (11776 bits) on interface 0
Ethernet II, Src: AsustekC_67:19:61 (00:18:f3:67:19:61), Dst: HonHaiPr_23:88:cd (9c:ad:97:23:88:cd)
Internet Protocol Version 4, Src: 128.119.245.12, Dst: 192.168.116.176
Transmission Control Protocol, Src Port: 80, Dst Port: 23394, Seq: 99913, Ack: 462, Len: 1406
[70 Reassembled TCP Segments (101318 bytes): #31(1448), #32(1448), #34(1448), #35(1448), #37(1448), #38(1448), #40(1448), #41(1448), #43(1448), #44(1448), #46(1448), #47(1448), #49(1448), #50(1448), #52(1448), #53(1448), #55(1448), #56(1448]
Hypertext Transfer Protocol
JPEG File Interchange Format

No.     Time           Source                Destination           Protocol Length Info
    136 5.723376       192.168.116.176       128.119.245.12        HTTP     513    GET /favicon.ico HTTP/1.1 

Frame 136: 513 bytes on wire (4104 bits), 513 bytes captured (4104 bits) on interface 0
Ethernet II, Src: HonHaiPr_23:88:cd (9c:ad:97:23:88:cd), Dst: AsustekC_67:19:61 (00:18:f3:67:19:61)
Internet Protocol Version 4, Src: 192.168.116.176, Dst: 128.119.245.12
Transmission Control Protocol, Src Port: 23392, Dst Port: 80, Seq: 957, Ack: 4685, Len: 447
Hypertext Transfer Protocol

No.     Time           Source                Destination           Protocol Length Info
    140 5.855043       128.119.245.12        192.168.116.176       HTTP     550    HTTP/1.1 404 Not Found  (text/html)

Frame 140: 550 bytes on wire (4400 bits), 550 bytes captured (4400 bits) on interface 0
Ethernet II, Src: AsustekC_67:19:61 (00:18:f3:67:19:61), Dst: HonHaiPr_23:88:cd (9c:ad:97:23:88:cd)
Internet Protocol Version 4, Src: 128.119.245.12, Dst: 192.168.116.176
Transmission Control Protocol, Src Port: 80, Dst Port: 23392, Seq: 4685, Ack: 1404, Len: 484
Hypertext Transfer Protocol
Line-based text data: text/html (7 lines)

_____________________________
Комментарий студента:
Из этих данных, я увидел, что произошло 4 запроса по протоколу HTTP, версия 1.1, используя метод запроса - GET. 
В ответ, на 3 запроса(первые 3), пришли ответы с кодом 200 ОК, что означает - запрос выполнен успешно.
На один из запросов(последний), пришел ответ 404 Not Found, что означает - сервер не может найти данные согласно запросу.
Суть перого запроса - получение файла html
Суть второго запроса - получаение картинки с расширением png
Суть третьего запроса  - получение картинки с расширенеи jpg
Суть четвертого запроса - получение файла favicon.ico
